"id","name","description","video_link","country","country_code","logo","website","channel","external"
"107","Colors TV","Watch Hindi general entertainment TV channel Colors TV live online. The channel is famous for entertainment shows, Indian drama serials, award shows, dance shows and much more. Colors TV also broadcasts exclusive premiers of latest Bollywood movies. The channel is also very famous for India’s biggest reality show Bigg Boss. The show is hosted by one of India’s most well known celebrities Salman Khan.","http://colors.in.com/","India","in","https://webradiodirectory.com/wp-content/uploads/2021/02/colorstv-50x35-1.jpg","http://colors.in.com/","https://www.youtube.com/user/colorstv/videos","1"
"109","CTS Taiwan News","CTS Taiwan News live streaming. Watch online free CTS Taiwan News live.","http://www.cts.com.tw","Taiwan","tw","https://webradiodirectory.com/wp-content/uploads/2021/02/cts-50x35-1.jpg","http://www.cts.com.tw",,"1"
"110","Dave and Ava","Dave and Ava is animated series developed especially for young children, ages 1-6.","https://www.youtube.com/watch?v=4TGQAeGpPL8","No Country","ww","https://webradiodirectory.com/wp-content/uploads/2021/02/daveandava-50x35-1.jpg","https://wayokids.com/dave-and-ava",,NULL
"111","Dawn News","Dawn News is one of Pakistan’s 24-hour Urdu news channel. Based in Karachi, the station is a subsidiary of Pakistan Herald Publications Limited (PHPL), Pakistan’s largest English-language media group. Checkout for the Latest and Top News from Pakistan and around the world.","http://www.dawn.com/","Pakistan","pk","https://webradiodirectory.com/wp-content/uploads/2021/02/dawn-news.jpg","http://www.dawn.com/",,"1"
"112","DD INDIA","DD india was launched in 1995 (then it was called DD International). The channel is owned by Doordarshan. The headquareter is based in New Delhi. The network features some original programming, such as dramas, comedy-series, talk shows and documentaries.","https://www.youtube.com/watch?v=pseficg1YbQ","India","in","https://webradiodirectory.com/wp-content/uploads/2021/02/DD-INDIA-24x7-50x35-1.jpg","http://doordarshan.gov.in/ddindia","https://www.youtube.com/channel/UCGDQNvybfDDeGTf4GtigXaw/videos",NULL
"113","DD National","DD National channel is the largest terrestrial network in the world covering about 92% population and 81% land area of the country. Being a Public Service Broadcaster the channel continues to make significant contribution to accelerate socio-economic changes, promote national integration, inculcate a sense of unity and fraternity and stimulate scientific temperament among the people.","https://www.youtube.com/watch?v=Sel7GWNeZT4","India","in","https://webradiodirectory.com/wp-content/uploads/2021/02/dd-national-50x35-1.jpg","https://doordarshan.gov.in/dd-national-live","https://www.youtube.com/user/DoordarshanNational/videos",NULL
"114","DD News","Doordarshan News is India’s only 24-hour terrestrial TV news channel. The Prasar Bharati company board approved the proposal to start a 24-hour news channel in place of DD Metro, which was closing. This was subsequently approved by the Union Cabinet in an 3 October 2003 meeting. Its terrestrial reach is 21.6% by area and 44.9% by population of India. The channel offers headlines, weather forecast and much more.","https://www.youtube.com/watch?v=Sel7GWNeZT4","India","in","https://webradiodirectory.com/wp-content/uploads/2021/02/dd-60x44-1.jpg","http://www.ddinews.gov.in/","https://www.youtube.com/user/DDNewsofficial/videos",NULL
"115","DD Punjabi","DD Punjabi is a Punjabi language TV channel dedicated to offer non stop entertainment channel completely owned by the state of Punjab. Started in the year 1998, the channel is currently produced and telecasted from Doordarshan Kendra Jalandhar, situated in Punjab, India. Since its launch 16 years back, the DD Punjabi Channel turned into a 24-hour service within just two years.","https://playhls.media.nic.in/live/ddpunjabi-360p/index.m3u8","India","in","https://webradiodirectory.com/wp-content/uploads/2021/02/ddpunjabi-60x44-1.jpg","http://www.ddpunjabi.in/","https://www.youtube.com/user/ddpunjabijal/videos",NULL
"116","Desi Channel","Desi Channel is a venture of AG Media, has launched a digital channel, and is being telecasted from Punjab, India. It is a new Entertainment and Devotional channel & we are available on all the major digital platforms. It is a complete package of entertainment channel due to its varieties of contents.","http://live.wmncdn.net/desichannel/7e2dd0aed46b70a5c77f4affdb702e4b.sdp/index.m3u8","India","in","https://webradiodirectory.com/wp-content/uploads/2021/02/logo10-60x44-1.jpg","http://www.desichannel.net/",,NULL
"117","Dilli Aaj Tak","The official Dilli Aaj Tak news and events live stream from India Today. Dilli Aaj Tak is India’s leading news channel which covers politics, sports, entertainment and cinema.","http://aajtak.intoday.in/dilliaajtak/","India","in","https://webradiodirectory.com/wp-content/uploads/2021/02/Delhi-Aaj-Tak-50x35-1.jpg","http://aajtak.intoday.in/dilliaajtak/","https://www.youtube.com/user/DilliAajtak/videos","1"
"118","Din News","DIN News provides the latest & breaking news, Urdu news from Pakistan and worldwide including sports, cricket, business, politics & health.","https://dinnews.tv/live","Pakistan","pk","https://webradiodirectory.com/wp-content/uploads/2021/02/din-50x35-1.jpg","https://dinnews.tv/live",,"1"
"119","Dubai One","Dubai One is a 24-hour free-to-air English language entertainment channel available in the Middle East, Europe and North Africa. It was launched on December 24, 2004. The channel focuses on the events happening in and around the United Arab Emirates city of Dubai. The channel offers mainly entertainment and movies.","http://www.dcn.ae/dubaitv/live.asp?lang=ar","United Arab Emirates","ae","https://webradiodirectory.com/wp-content/uploads/2021/02/dubai-one-60x44-1.jpg","http://www.dcn.ae/","https://www.youtube.com/channel/UCnxcG6CqTO85dBXlyjPKInA/videos","1"
"120","Dubai Sports","The 24/7 sports channel based in Dubai, United Arab Emirates is the home for sports news around the country. The channel started in 1998 to be the home for sports news around the country and was awarded the privilege of showing different sports events locally and worldwide. It is one of the channels of Dubai Media Incorporated.","http://www.dubaisports.ae/content/dubaisports/livestreaming.html","United Arab Emirates","ae","https://webradiodirectory.com/wp-content/uploads/2021/02/DUBAI-SPORTS-60x44-1.jpg","http://www.dcn.ae/dubaisports/","https://www.youtube.com/channel/UCmJr9VRnC8Q1TCIrf2G8bcg/videos","1"
"121","Duniya Tak","Watch Dunya Tak live news channel from India official live streaming. This channel provides latest news, political talk shows, breaking news, current affairs programs and much more. Dunya tak is one of the most watched news channels in India.","https://www.youtube.com/watch?v=-M-YQUzGfX4","India","in","https://webradiodirectory.com/wp-content/uploads/2021/02/IMG_20190228_031457-50x35-1.jpg",,"https://www.youtube.com/channel/UC2GRJOrY04aZjTmeBKr7nLA/videos",NULL
"122","Dunya News","Dunya News is news and current affairs television channel from Pakistan. It’s head office is situated at Lahore, Pakistan. Since its launch in 2008, the channel have been giving strong competition to the other news channels in the country.","http://dunyanews.tv/","Pakistan","pk","https://webradiodirectory.com/wp-content/uploads/2021/02/dunya-50x35-1.jpg","http://dunyanews.tv/","https://www.youtube.com/user/dunyanews1/videos","1"
"123","DW English","DW Live provides world news and current affairs from the heart of Europe across the globe. DW English is the flagship channel for Germany’s international audience. DW News is a global English-language news and information channel from a German international broadcaster Deutsche Welle (DW)","https://www.youtube.com/watch?v=gOoTbPssAo4","Germany","de","https://webradiodirectory.com/wp-content/uploads/2021/02/dw-50x35-1.jpg","https://www.dw.com/",,NULL
"124","DY 365","DY365 is a regional 24-hour satellite channel located in the province of Assam. Assam is a state of India in the north-eastern region. Its capital is Dispur. DY365 broadcasts news in Assamese, Hindi, Bengali and English language. It was launched in 2008.","http://cdn.smartstream.video/smartstream-us/dy365/dy365/chunklist_w2030810750.m3u8","India","in","https://webradiodirectory.com/wp-content/uploads/2021/02/dy365-60x44-1.jpg","http://dy365.in/","https://www.youtube.com/user/dy365/videos",NULL
"125","E4","With E4 the “E” stands for entertainment. Programming includes Friends, ER, The O.C., Smallville, The Sopranos, What About Brian?, Desperate Housewives, 90210, Gilmore Girls, One Tree Hill, Scrubs, and British dramas such as Shameless, Hollyoaks, Skins and Nearly Famous. Some of the imports, e.g. The O.C., Ugly Betty and Desperate Housewives, are screened on E4 up to one week ahead of their Channel 4 broadcasts.","https://www.filmon.com/tv/channel/export?channel_id=65&source_type=iframe","United Kingdom","gb","https://webradiodirectory.com/wp-content/uploads/2021/02/Untitled30-60x44-1.jpg","http://www.channel4.com/e4","https://www.youtube.com/user/e4/videos",NULL
"126","Ekhbariya TV","Al Ekhbariya is a very popular Saudi TV channel. It is an Arabic satellite TV channel operated by Ministry of Culture and Information . The channel provides news and current affairs and is based Riyadh, the Capital of Saudi Arabia.","http://alekhbariya.net/ar/live","Saudi Arabia","sa","https://webradiodirectory.com/wp-content/uploads/2021/02/khabriya-60x44-1.jpg","http://www.ekhbariyatv.sa/","https://www.youtube.com/user/SaudiNewsTV/videos","1"
"127","EPT 1","ERT’s television channel went off air in the middle of a programme in 2013, and viewers saw only a black screen. Until June 12 2015 ERT it was only broadcasting on the Internet. This was done by Former ERT employees demanding the reopening of the company ERT. Now the official public broadcaster is back with live reports, news and culture.","https://webtv.ert.gr/ert1-live/","Greece","gr","https://webradiodirectory.com/wp-content/uploads/2021/02/ept1-50x35-1.jpg","http://webtv.ert.gr/","https://www.youtube.com/user/ertsocialnetworks/videos","1"
"128","Euronews","Euronews aims to cover world news from a pan-European perspective. The channel is available in 350 million households in 155 countries worldwide. It reaches more than 170 million European households by cable, satellite and terrestrial. It also began to secure availability on multimedia platforms such as IPTV and digital media.","http://www.euronews.com/","United Kingdom","gb","https://webradiodirectory.com/wp-content/uploads/2021/02/euro-60x44-1.jpg","http://www.euronews.com/","https://www.youtube.com/user/Euronews/videos","1"
"129","Euronews France","Euronews is a European, multilingual news television channel, headquartered in Lyon-Ecully, France. Created in 1993, it claims to be covering world news from a Pan-European perspective.","https://www.youtube.com/watch?v=MsN0_WNXvh8","France","fr","https://webradiodirectory.com/wp-content/uploads/2021/02/euronews-48x35-1.jpg","http://www.euronews.com/",,NULL
"130","European films","European films from the 70’s, thrillers, cult horror, comedy and more. Watch European films & movies online on your laptop or phone for free!","http://www.filmon.com/tv/channel/export?channel_id=3074&affid=223489Mv&source_type=iframe","No Country","ww","https://webradiodirectory.com/wp-content/uploads/2021/02/europeanfilm-50x35-1.jpg",,,NULL
"131","Express News","Express News is a prime Urdu news channel of Pakistan, the channel mainly focus on social issues, society and current affairs. The slogan of Express News is (Har Khabar Par Nazar) that slogan is true in its own. Express News Network is very wide and they provide time to time News of current happenings, timely news updates of the changing political and global scenario.","https://5ab29cc78f681.streamlock.net/expressdigital1/livestream/chunklist_w638840335.m3u8","Pakistan","pk","https://webradiodirectory.com/wp-content/uploads/2021/02/ExpressNews-50x35-1.jpg","http://www.express.pk/","https://www.youtube.com/channel/UCTur7oM6mLL0rM2k0znuZpQ",NULL
"132","Express TV","Express Entertainment is a Pakistani entertainment television channel that airs dramas, soaps and lifestyle programs. Express Entertainment was launched on January 2012. Express Entertainment and sister station Express News are part of Express Media Group. Express Entertainment airs through Prime TV in the United Kingdom and Europe.","https://5dcabf026b188.streamlock.net:443/expressdigital/livestream/playlist.m3u8","Pakistan","pk","https://webradiodirectory.com/wp-content/uploads/2021/02/express-ent-60x44-1.jpg","http://www.expressentertainment.tv/",,NULL
"133","Extra News","Extra News is a channel that is specializing in live coverage of events and current affairs. For lovers of Arab and international developments, the channel is keen to cover the most important Arab and international issues, especially issues affecting the Egyptian affairs from near or far.","https://www.youtube.com/watch?v=bvEcsfFxtF0","Egypt","eg","https://webradiodirectory.com/wp-content/uploads/2021/02/eXtra-News-48x35-1.jpg","https://extranews.tv/","https://www.youtube.com/channel/UC65F33K2cXk9hGDbOQYhTOw",NULL
"134","Film 4","Free, every day. Film4’s unbeatable line-up of great movies guarantees something for every type of film fan. Film4 showcases the widest range of titles including classics, the latest Hollywood epics, the best of US and UK independent cinema, foreign flicks and cult cinema.","http://www.filmon.com/tv/channel/export?channel_id=13&affid=223489Mv&source_type=iframe","United Kingdom","gb","https://webradiodirectory.com/wp-content/uploads/2021/02/film4-60x44-1.jpg","http://www.film4.com/","https://www.youtube.com/user/Film4video/videos",NULL
"135","Food Network","Food Network UK brings a fresh perspective to the UK food scene by offering an irresistible combination of credible cooking, new ideas and high-energy lifestyle entertainment. Food Network is UK’s top 24-hour cooking channel bringing great recipes for you to cook at home.","http://www.foodnetwork.co.uk/","United Kingdom","gb","https://webradiodirectory.com/wp-content/uploads/2021/02/Untitled32-60x44-1.jpg","http://www.foodnetwork.co.uk/","https://www.youtube.com/user/foodnetworkuk/videos","1"
"136","Fox 11 LA","FOX 11 or KTTV, channel 11, is an owned-and-operated television station of the Fox Broadcasting Company and located in Los Angeles. It started in 1949. When they are not in a live newscast, you will see replays of earlier broadcasts.","http://www.foxla.com/","United States","us","https://webradiodirectory.com/wp-content/uploads/2021/02/fox-news-1-50x35-1.jpg","http://www.foxla.com/",,"1"
"137","Fox 12 Oregon","KPTV (Fox 12) is a Fox-affiliated television station located in Portland, Oregon. The studios are located on Sunset Highway in Beaverton, while its transmitter is located in the Sylvan-Highlands section of Portland. KPTV 12 offers live online newstcast.","https://livestream.com/kptv/Live","United States","us","https://webradiodirectory.com/wp-content/uploads/2021/02/fox-news-1-50x35-2.jpg","http://www.kptv.com/",,NULL
"138","Fox 13 Salt Lake","Fox 13 (KSTU), is a Fox-affiliated television station located in Salt Lake City, Utah, United States. KSTU first aired in 1978. Live news broadcasts are displayed. When no news is being broadcast live, you’ll see a replay of recent newscasts.","http://www.fox13now.com/","United States","us","https://webradiodirectory.com/wp-content/uploads/2021/02/fox-news-1-50x35-3.jpg","http://www.fox13now.com/",,"1"
"139","Fox 13 Tampa Bay","WTVT, is a Fox owned-and-operated television station located in Tampa, Florida and also serving the nearby city of St. Petersburg. If you see a radarimage, the channel probably is in commercials. If it says -stream unavailable,- there is probably no newscast.","http://www.fox13news.com/","United States","us","https://webradiodirectory.com/wp-content/uploads/2021/02/fox-news-1-50x35-4.jpg","http://www.fox13news.com/",,"1"
"140","Fox 19 Cincinnati","WXIX-TV, (UHF digital channel 29), is a Fox-affiliated television station serving Cincinnati, Ohio, United States. Fox 19 broadcasts live news programs on their website.","http://www.fox19.com/","United States","us","https://webradiodirectory.com/wp-content/uploads/2021/02/fox-news-1-50x35-5.jpg","http://www.fox19.com/",,"1"
"141","Fox 2 Detroit","Fox 2 or (WJBK), is a Fox owned-and-operated television station located in Detroit, Michigan. It first aired in 1948! It is mainly broadcasting short news flashes interrupted by brakes on the internet.","http://www.myfoxdetroit.com/","United States","us","https://webradiodirectory.com/wp-content/uploads/2021/02/fox-news-1-50x35-6.jpg","http://www.myfoxdetroit.com/",,"1"
"142","Fox 2 St. Louis","TVI is a Fox-affiliated television station located in St. Louis, Missouri, United States. It first aired in 1953. KTVI’s transmitter is located in the unincorporated community of Sappington.","https://livestream.com/ktvi/live","United States","us","https://webradiodirectory.com/wp-content/uploads/2021/02/fox-news-1-50x35-7.jpg","http://www.fox2now.com/",,NULL
"143","Fox 25 Boston","Fox 25 Boston (WFXT), is a Fox-affiliated television station located in Boston, Massachusetts, United States (it serves also the Akron area). It first aired in 1977. It shows mainly News and Weather updates on the Internet.","https://www.fox25boston.com/","United States","us","https://webradiodirectory.com/wp-content/uploads/2021/02/fox-news-1-50x35-8.jpg","https://www.fox25boston.com/",,"1"
"144","Fox 26 Houston","KRIV or Fox 26, is a Fox owned-and-operated television station located in Houston, Texas, United States. It began broadcasting in 1971. They offer live newscasts, trafficcams and weather doppler radar images.","http://www.fox26houston.com/","United States","us","https://webradiodirectory.com/wp-content/uploads/2021/02/fox-news-1-50x35-9.jpg","http://www.fox26houston.com/",,"1"
"145","Fox 31 Denver","KDVR is a Fox-affiliated television station located in Denver, Colorado, United States. When no news is being broadcast live, you’ll see a replay of recent newscasts.","https://livestream.com/kdvr/live","United States","us","https://webradiodirectory.com/wp-content/uploads/2021/02/fox-news-1-50x35-10.jpg","http://www.kdvr.com/",,NULL
"146","Fox 32 Chicago","Fox Chicago or WFLD is a Fox-affiliated television station located in Chicago, Illinois. The channel broadcasts informative programs, press conferences and other breaking news coverage on the Internet.","http://www.fox32chicago.com/","United States","us","https://webradiodirectory.com/wp-content/uploads/2021/02/fox-news-1-50x35-11.jpg","http://www.fox32chicago.com/",,"1"
"147","Fox 35 Orlando","Fox Orlando (WOFL), is a Fox-affiliated television station located in Orlando, Florida, United States. It first aired in 1974. It shows mainly News and Weather updates on the Internet.","http://www.fox35orlando.com/","United States","us","https://webradiodirectory.com/wp-content/uploads/2021/02/fox-news-1-50x35-12.jpg","http://www.fox35orlando.com/",,"1"
"148","Fox 4 Dallas","Fox Dallas (KDFW), is a Fox-affiliated television station located in Dallas, Texas, United States. It first aired in 1949. It shows mainly News and Weather updates on the Internet.","http://www.fox4news.com/","United States","us","https://webradiodirectory.com/wp-content/uploads/2021/02/fox-news-1-50x35-13.jpg","http://www.fox4news.com/",,"1"
"149","FOX 4 Kansas City","Fox 4 or KSAS-TV is the Fox-affiliated television station for Wichita, Kansas. It was first on air in 1985. It offers live news broadcasts. FOX 4 is the largest news team in Kansas City television.","https://livestream.com/accounts/2304479/events/1745643/player?width=640&height=360&enableInfoAndActivity=true&autoPlay=true&mute=false&source_type=iframe","United States","us","https://webradiodirectory.com/wp-content/uploads/2021/02/fox-news-1-50x35-14.jpg","http://fox4kc.com/","https://www.youtube.com/user/myfoxdfw/videos",NULL
"150","Fox 40 Sacramento","Fox 40 or KTXL is a local TV from Sacramento. The channel first aired in 1968. The station is owned by the Tribune.","https://livestream.com/KTXL/live","United States","us","https://webradiodirectory.com/wp-content/uploads/2021/02/fox-news-1-50x35-15.jpg","http://fox40.com/",,NULL
"151","Fox 5 Atlanta","WAGA-TV, channel 5 (Fox 5) is an owned-and-operated television station of the Fox Broadcasting Company, located in Atlanta, Georgia, USA. WAGA was founded in 1949.","http://www.fox5atlanta.com/","United States","us","https://webradiodirectory.com/wp-content/uploads/2021/02/fox-news-1-50x35-16.jpg","http://www.fox5atlanta.com/",,"1"
"152","Fox 5 Las Vegas","Fox 5 Las Vegas (KVVU), is a Fox-affiliated television station located in Las Vegas, Nevada, United States. It first aired in 1967. It shows mainly News and Weather updates on the Internet.","https://livestream.com/kvvu/Live","United States","us","https://webradiodirectory.com/wp-content/uploads/2021/02/fox-news-2-50x35-1.jpg","http://www.fox5vegas.com/",,NULL
"153","Fox 5 New York","Fox 5 or WNYW is a Fox affiliated Television channel based in New York. The channel first aired in 1944. On the Internet Fox 5 mainly offers News flashes, weather and traffic updates.","http://www.fox5ny.com/","United States","us","https://webradiodirectory.com/wp-content/uploads/2021/02/fox-news-2-50x35-2.jpg","http://www.fox5ny.com/",,"1"
"154","Fox 5 Washington","Fox 5 or WTTG is an owned and operated by Fox. The television station is located in the U.S. capital of Washington, D.C.. It aired first in 1947. It offers news and informative programming.","http://www.fox5dc.com/","United States","us","https://webradiodirectory.com/wp-content/uploads/2021/02/fox-news-2-50x35-3.jpg","http://www.fox5dc.com/",,"1"
"155","Fox 59 Indianapolis","Fox 59 (WXIN), is a Fox-affiliated television station located in Indianapolis, Indiana, United States. It first aired in 1983. It shows mainly News and Weather updates.","https://livestream.com/WXIN/live","United States","us","https://webradiodirectory.com/wp-content/uploads/2021/02/fox-news-2-50x35-4.jpg","http://fox59.com/",,NULL
"156","Fox 6 Birmingham","Fox 6 or WBRC, is a Fox-affiliated television station serving Tuscaloosa, Anniston and in Birmingham, Alabama. The station is owned by Raycom Media. It airs short news events.","https://livestream.com/WBRC/live","United States","us","https://webradiodirectory.com/wp-content/uploads/2021/02/fox-news-2-50x35-5.jpg","http://www.wbrc.com/",,NULL
"157","Fox 61 CT Hartford","Fox CT (WTIC) is a Fox affilitate local TV channel from Hartford, Connecticut. The channel first aired in 1984. It offers news, weather and traffic updates on the Internet.","https://livestream.com/WTIC/live","United States","us","https://webradiodirectory.com/wp-content/uploads/2021/02/fox-news-2-50x35-6.jpg","http://fox61.com/",,NULL
"158","Fox 7 Austin","Fox 7 Austin (KTBC), is a Fox-affiliated television station located in Austin, Texas, United States. It first aired in 1952. It shows mainly News and Weather updates on the Internet.","http://www.fox7austin.com/","United States","us","https://webradiodirectory.com/wp-content/uploads/2021/02/fox-news-2-50x35-7.jpg","http://www.fox7austin.com/",,"1"
"159","Fox 8 Cleveland","Fox 8 Cleveland (WJW), is a Fox-affiliated television station located in Cleveland, Texas, United States (it serves also the Akron area). It first aired in 1949. It shows mainly News and Weather updates on the Internet.","https://livestream.com/Fox8News/live","United States","us","https://webradiodirectory.com/wp-content/uploads/2021/02/fox-news-2-50x35-8.jpg","http://fox8.com/",,NULL
"160","Fox 9 Twin Cities","Fox 9 Twin Cities (KMSP), is a Fox-affiliated television station located in Fox 29 Twin Cities, Minnesota, United States. It first aired in 1955. It shows mainly News and Weather updates on the Internet.","http://www.fox9.com/","United States","us","https://webradiodirectory.com/wp-content/uploads/2021/02/fox-news-2-50x35-9.jpg","http://www.fox9.com/",,"1"
"161","Fox News","Fox news is news oriented channel bringing latest news from around the globe. It is is an American basic cable and satellite news television channel that is owned by the Fox Entertainment Group subsidiary of 21st Century Fox. As of August 2013, approximately 97,186,000 American households receive the Fox News Channel. The channel broadcasts primarily from studios at Rockefeller Center in New York City.","https://www.foxnews.com/","United States","us","https://webradiodirectory.com/wp-content/uploads/2021/02/fox-news-60x44-1.jpg","https://www.foxnews.com/","https://www.youtube.com/channel/UCXIJgqnII2ZOINSWNOGFThA","1"
"162","France 24 English","France 24 is an international news and current affairs television channel based in Paris. The channel is owned by the French Government and was launched in 2006. This channel is aiming for an English speaking audience. Breaking news and world news from France 24 on Business, Sports, Culture and much more.","https://www.youtube.com/watch?v=HeTWwH1a0CQ","France","fr","https://webradiodirectory.com/wp-content/uploads/2021/02/france-24-60x44-1.jpg","http://www.france24.com/en/","https://www.youtube.com/user/france24english/videos",NULL
"163","France Info","France Info is a news and general interest TV channel. France Info was founded in 1987 by Radio France. The headquarter is based in the capital of France, Paris.","https://www.youtube.com/watch?v=wwNZKfBLAsc","France","fr","https://webradiodirectory.com/wp-content/uploads/2021/02/franceinfo-50x35-1.jpg","https://www.francetvinfo.fr/",,NULL
