"id","name","description","video_link","country","country_code","logo","website","channel","external"
"275","Newsfirst","Sri Lankas first international news channel, broadcasting in Sinhalese, Tamil and English across three TV channels, four radio channels.","https://www.youtube.com/watch?v=zWfoX_jM0Hg","Sri Lanka","lk","https://webradiodirectory.com/wp-content/uploads/2021/02/unnamed-50x35-1.jpg","https://www.newsfirst.lk","https://www.youtube.com/channel/UCgnFSj7jQffD5V5m05j4dPw",NULL
"276","Newsmax TV","Newsmax TV is news TV channel offering news about politics, national and world news, health, faith, personal finance and technology. Newsmax TV is based in West Palm Beach, Florida. It has offices in Washington, D.C. and New York City. The channel was founded in 1998.","http://www.newsmaxtv.com/","United States","us","https://webradiodirectory.com/wp-content/uploads/2021/02/Newsmax-TV-50x35-1.jpg","http://www.newsmaxtv.com/",,"1"
"277","Noor TV","Noor TV is a UK based Satellite Television Channel. It is owned by Aleha Digital Televsion. Noor TV provides quality television programes for the 12 Million Muslims across Europe.","https://ls1.serverdump.com/stream3.m3u8","Pakistan","pk","https://webradiodirectory.com/wp-content/uploads/2021/02/Untitled20-60x44-1.jpg","http://thenoor.tv/","https://www.youtube.com/user/noortvchannel/videos",NULL
"278","NTV","NTV is General TV channel owned by the Nation Media Group and was founded in 2005. It offers a variety of programs, including news, tv-series and religious programs.","//www.dailymotion.com/embed/video/x6shkab?autoPlay=1&source_type=iframe","Kenya","ke","https://webradiodirectory.com/wp-content/uploads/2021/02/ntv-1-50x35-1.jpg","http://www.ntv.co.ke/",,NULL
"279","NTV","NTV is a Turkish nationwide television news channel. It was partnered with MSNBC between May 2000 and 2014. Besides domestic and international news, the channel’s programming includes documentaries, as well as programs on finance, arts and culture, lifestyle, and sports.","https://www.youtube.com/watch?v=XEJM4Hcgd3M","Turkey","tr","https://webradiodirectory.com/wp-content/uploads/2021/02/ntvturkey-50x35-1.jpg","http://www.ntv.com.tr/","https://www.youtube.com/channel/UC9TDTjbOjFB9jADmPhSAPsw",NULL
"280","NTV","NTV is a very popular Bangla TV channel that offers diverse mix of programs such as news bulletins, current affairs, talk shows, soap operas, educational, religious, politics related programs, drama, movie, reality shows and other entertainment programs. It delivers news and entertainment programs across all platforms: TV, Internet and Mobile.","https://www.youtube.com/watch?v=nxTdcjWT918","Bangladesh","bd","https://webradiodirectory.com/wp-content/uploads/2021/02/ntv-50x35-1.jpg","http://www.ntvbd.com/","https://www.youtube.com/channel/UCYqujAD5831EywH1jldBu5w",NULL
"281","NTV Telugu","Watch NTV Live Telugu (HD) live streaming. This channel shows diverse programs such as news bulletins, current affairs, talk shows, soap operas, educational, religious, politics related programs, drama, movie, reality shows, and other entertainment programs.","https://www.youtube.com/watch?v=ECLj8LyGKWc","India","in","https://webradiodirectory.com/wp-content/uploads/2021/02/ntv-2-50x35-1.jpg","http://www.ntvtelugu.com/","https://www.youtube.com/channel/UCumtYpCY26F6Jr3satUgMvA",NULL
"282","NTV Uganda","Watch NTV Uganda live streaming. NTV Uganda is Uganda’s leading TV station, fast and first with the most reliable, objective and comprehensive news, plus unrivaled quality programming.","http://www.ntv.co.ug/","Uganda","ug","https://webradiodirectory.com/wp-content/uploads/2021/02/ntvuganda-50x35-1.jpg","http://www.ntv.co.ug/","https://www.youtube.com/user/ntvuganda/videos","1"
"284","Om Nom Stories","The series chronicles Om Nom’s adventures with a young boy named Evan, beginning with the little monster’s mysterious appearance on the boy’s doorstep in Episode 1. The animation series goes on to reveal Om Nom’s mischievous, yet endearing personality as he and Evan bond over day-to-day activities such as playing games, exploring house-hold items and celebrating holidays.","https://www.youtube.com/watch?v=UYWxnamnjmw","No Country","ww","https://webradiodirectory.com/wp-content/uploads/2021/02/omnom-50x35-1.jpg","https://network.hooplakidz.com/",,NULL
"285","ORTM","The Office of Radio and Television of Mali (ORTM) is the national broadcaster of the West African state of Mali. Television broadcasts started in 1983. The TV station is located in Bamako.","//www.dailymotion.com/embed/video/x5tcmdy?source_type=iframe","Mali","ml","https://webradiodirectory.com/wp-content/uploads/2021/02/ortm-50x35-1.jpg","http://ortm.ml/",,NULL
"286","OTV","Watch Online OTV Live Odisha News channel from India with high-quality streaming.","https://www.youtube.com/watch?v=RMKeEPRhIyo","India","in","https://webradiodirectory.com/wp-content/uploads/2021/02/otv-50x35-1.jpg","https://content.vidgyor.com/live/midroll/html/odishatv_amp.html",,NULL
"287","P7 News","P7 News or Sach Zaruri Hai is a 24 hours Hindi News Channel. P7 News has been positioned to cater to the viewer ship to the entire country with a special focus on key Hindi speaking States in the Hindi speaking belt. P7 News covers all the areas from fashion to philosophy, entertainment and music, science and technology and will try to cover all that aspects of human life.","http://www.p7news.tv/livetv-p7news.html","No Country","ww","https://webradiodirectory.com/wp-content/uploads/2021/02/p7-60x44-1.jpg","http://www.p7news.tv/",,"1"
"288","Peace TV","Peace TV is a 24-hours Islamic TV channel and a free-to-air television network. Peace TV programs are in Bengali, Urdu and English languages. The channel was launched in 2011.","http://peacetvnetwork.visionip.tv/live","India","in","https://webradiodirectory.com/wp-content/uploads/2021/02/peace-tv.jpg","http://peacetvnetwork.visionip.tv/live","https://www.youtube.com/user/officialpeacetv","1"
"289","Peace TV Bangla","Peace TV is a 24-hours Islamic TV channel and a free-to-air television network. Peace TV programs are in Bengali, Urdu and English languages. The channel was launched in 2011.","http://peacetvnetwork.visionip.tv/live","Bangladesh","bd","https://webradiodirectory.com/wp-content/uploads/2021/02/peace-tv-1.jpg","http://peacetvnetwork.visionip.tv/live",,"1"
"290","Peppa Pig Cartoons","Peppa lives with her mummy and daddy and her little brother, George. Her adventures are fun, sometimes involve a few tears, but always end happily. Welcome to the Official Peppa Pig channel, a world of Peppa with episodes and compilations to keep even the most dedicated Peppa fans happy. Enjoy and don’t forget to share!","https://www.youtube.com/watch?v=PjvP3WO9bM4","No Country","ww","https://webradiodirectory.com/wp-content/uploads/2021/02/peppa-50x35-1.jpg","http://www.peppapig.com/intro","https://www.youtube.com/user/theofficialpeppa/videos",NULL
"291","PIK Sat","PIK Sat is satellite TV channel from the Cyprus Broadcasting Corporation or CyBC. CyBC is a non-profit organization promotion its main mission, which is the objective provision of information, culture and entertainment for the people of Cyprus.","http://www.riknews.com.cy/","Cyprus","cy","https://webradiodirectory.com/wp-content/uploads/2021/02/RIK-50x35-1.jpg","http://www.riknews.com.cy/",,"1"
"292","PJ Masks","Watch PJ Masks live streaming. Kids like superheroes, so what could be better for tykes than becoming superheroes themselves? That’s what happens at night for young friends Connor, Amaya and Greg. When they put on their pyjamas and activate their animal amulets, they turn into their alter egos — Catboy, Owlette and Gekko — before embarking on adventures that are filled with action. Along the way, they solve mysteries and learn valuable lessons.","https://www.youtube.com/watch?v=qJvufyAp3-w","No Country","ww","https://webradiodirectory.com/wp-content/uploads/2021/02/PJ-Masks-50x35-1.jpg","http://pjmasks.co.uk/",,NULL
"293","Pogo TV","Pogo TV channel primarily focuses on airing animated shows for kids and some fun based live-action shows from Mumbai, the capital city of Maharashtra. Pogo is a cable and Satellite television channel produced by Turner Broadcasting. It is unit of Time Warner for India. Pogo is a 24-hrs fun filled channel for the younger lot.","https://www.youtube.com/watch?v=YCfhqpQoXvU","India","in","https://webradiodirectory.com/wp-content/uploads/2021/02/pogo-60x44-1.jpg","http://www.pogo.tv/",,NULL
"294","Polimer News","Polimer News is a Tamil-language satellite television channel based in Chennai, India. Polimer channel was established by P.V. Kalyana Sundaram as a local channel in Salem, which was telecasted only by cable operators, later it became Tamil Nadu state entertainment channel.","https://www.youtube.com/watch?v=BC52ueB-cgE","India","in","https://webradiodirectory.com/wp-content/uploads/2021/02/polimar-news-50x35-1.jpg","https://www.polimernews.com/","https://www.youtube.com/channel/UC8Z-VjXBtDJTvq6aqkIskPg/videos",NULL
"295","Polly Pocket","Watch Polly Pocket official series online free.","https://www.youtube.com/watch?v=yRDuTHL3jFY","No Country","ww","https://webradiodirectory.com/wp-content/uploads/2021/02/Polly-Pocket-50x35-1.jpg","http://www.pollypocket.com/",,NULL
"296","Pop","POP is a high energy channel for kids. POP delivers a fresh and diverse mix of shows. Silly cartoons, fun how to facts and game shows all combine to form an entertaining and inspiring bundle for children.","http://www.filmon.com/tv/channel/export?channel_id=320&affid=223489Mv&source_type=iframe","United Kingdom","gb","https://webradiodirectory.com/wp-content/uploads/2021/02/pop-60x44-1.jpg","http://www.popfun.co.uk/","http://www.youtube.com/user/popfuntv/videos",NULL
"297","Press TV","Press TV is a 24-hour English language news organization of the Islamic Republic of Iran Broadcasting (IRIB). It is state-owned but independent of the Iranian government in its management, and its head is appointed directly by the supreme leader, Ayatollah Ali Khamenei. IRIB is the only legal TV and radio broadcaster inside Iran, and is close to Iran’s conservative political faction. Press TV broadcasts in English on a round-the-clock schedule.","https://live2.presstv.com/liveprs/smil:liveprs.smil/chunklist_w2115435019_b644100_slen.m3u8","Iran","ir","https://webradiodirectory.com/wp-content/uploads/2021/02/press-tv-60x44-1.jpg","http://www.presstv.ir/","https://www.youtube.com/user/presstvlondon/videos",NULL
"298","PTI Insaf TV","PTI Insaf TV Live Streaming, Pakistan Tehreek-e-Insaf’s official channel which covers all their Jalsa and election campaigns and other events and news. Watch Insaf TV Live only on DesiFreeTV.","http://www.insaftv.pk/","Pakistan","pk","https://webradiodirectory.com/wp-content/uploads/2021/02/PTI.jpg","http://www.insaftv.pk/",,"1"
"299","PTV Home","PTV Home or PTV is Pakistan Television Corporation’s flagship channel which is broadcast worldwide through satellite. PTV is a 24-hour Pakistani entertainment television which broadcasts entertainment shows, music, award shows, dramas and much more. PTV entered into Television Broadcasting age with a small pilot TV Station established at Lahore from where transmission was first beamed in Black & White with effect from 26 November 1964.","https://www.ptv.com.pk/ptvCorporate/homelive","Pakistan","pk","https://webradiodirectory.com/wp-content/uploads/2021/02/Untitled23-60x44-1.jpg","https://www.ptv.com.pk/ptvCorporate/homelive",,"1"
"300","PTV News","Pakistan Television News informs its viewers across the country on the latest newsworthy happenings on the national and international levels. It provides on-camera reporting and special news reports on subjects of popular interest. Merit and objectivity are being maintained as a hallmark of PTV news items which extends to routine day-to-day coverage and to the parliamentary proceedings, political activities of the government and opposition, besides human interest stories.","http://news.ptv.com.pk","Pakistan","pk","https://webradiodirectory.com/wp-content/uploads/2021/02/Untitled22-60x44-1.jpg","http://news.ptv.com.pk",,"1"
"301","PTV Sports","PTV Sports is a 24-hour Pakistani sports channel owned by PTV Network. PTV Sports was launched on 14 January 2012. Its test transmission began on December 2011 on Asia Sat. It is a state-owned channel. PTV Sports has telecast many sports events since it is launched. It has also got rights of many sports events like cricket, tennis, hockey and football.","http://stream.ptv.com.pk:1935/ptvworld/myStream/chunklist_w572744193.m3u8","Pakistan","pk","https://webradiodirectory.com/wp-content/uploads/2021/02/ptvsports-50x35-1.jpg","http://www.ptv.com.pk/public/userView/ptvCorporate/sportslive","https://www.youtube.com/channel/UC0KT03NPnN-j4HGzetW9Lpw/videos",NULL
"302","PTV World","PTV World is a 24-hour Pakistani English news channel owned by Pakistan Television Corporation. PTV World was inaugurated on 29 January 2013 by former president Asif Ali Zardari. It is state owned channel, offer a mixture of programming such as news, talk shows, documentaries, music and much more.","http://home.ptv.com.pk/","Pakistan","pk","https://webradiodirectory.com/wp-content/uploads/2021/02/ptv.jpg","http://home.ptv.com.pk/",,"1"
"303","Public News","Public News keeps you fully updated of the latest and major happenings in Pakistan and around the globe in the form of breaking news, bulletins, well-equipped talk shows. Public News serves as your ultimate news guide.","https://www.youtube.com/watch?v=D8lPs2SPR0w","Pakistan","pk","https://webradiodirectory.com/wp-content/uploads/2021/02/public-news-50x35-1.jpg","http://www.publicnews.com/","https://www.youtube.com/channel/UCElJZvY_RVra6qjD8WSQYog/videos",NULL
"304","PublicTV","Public TV News brings you latest breaking news from every corner of Karnataka, including political news, entertainment news, sandalwood news, breaking news, celebrity news, sting operations and more. The viewers can access the most popular Kannada news channel on their mobiles, tablets, smartphones and desktops. Watch Public TV live stream for the latest news, breaking news events and political developments.","https://content.vidgyor.com/live/midroll/html/publictv.html?source_type=iframe","India","in","https://webradiodirectory.com/wp-content/uploads/2021/02/public-tv-50x35-1.jpg","https://publictv.in/","https://www.youtube.com/channel/UCl-OodciBGZ0k8K8rBZGe4w",NULL
"305","Punjab Tak","Punjab Tak is a news channel about Punjab and Punjabis residing in the different parts of the world. It covers news about People, Politics, Sports, Entertainment and International affairs that interest Punjabis.","https://www.youtube.com/channel/UCJ-F1ElALMfXS74xaWja8jg","India","in","https://webradiodirectory.com/wp-content/uploads/2021/02/punjab-50x35-1.jpg",,"https://www.youtube.com/channel/UCJ-F1ElALMfXS74xaWja8jg","1"
"306","Puthiya Thalaimurai TV","Puthiya Thalaimurai TV is a Tamil news channel. The channel was founded in 2011. The headquarter is based in Chennai, Tamil Nadu and is owned by the SRM Group of Companies. It broadcasts news, discussion, documentary and infotainment programmes.","https://www.youtube.com/watch?v=K6i3vcQe-IY","India","in","https://webradiodirectory.com/wp-content/uploads/2021/02/Puthiya-Thalaimurai-TV-50x35-1.jpg","http://www.puthiyathalaimurai.com/","https://www.youtube.com/user/PTTVOnlineNews/videos",NULL
"307","Quran TV","Quran TV is a TV channel operated by the Ministry of Culture and Information. It offer Quran related religious programing as well as live webcam coverage of the Masjid al-Haram?, the Sacred Mosque or The Grand Mosque along with audio in Arabian of Quran passages.","http://www.qurantv.sa/","Pakistan","pk","https://webradiodirectory.com/wp-content/uploads/2021/02/quran-tv-50x35-1.jpg","http://www.qurantv.sa/",,"1"
"308","QVC","QVC (Quality, Value, Convenience) is a broadcast Television Network specialized in Home Shopping. The Network was launched in 1986. QVC had a reach of 0ver 200 million households Worldwide.","https://www.youtube.com/watch?v=fAeq61gxu00","United States","us","https://webradiodirectory.com/wp-content/uploads/2021/02/qvc-50x35-1.jpg","http://www.qvc.com/","https://www.youtube.com/channel/UCW4gXUEypFeI3xgoQ27LFBA",NULL
"309","Raah TV","Raah TV is a Pakistani infotainment web channel with a vision to promote positivity, optimism and hope. Watch latest informative shows online 24X7 and stay up-to-date.","http://www.raah.tv/","Pakistan","pk","https://webradiodirectory.com/wp-content/uploads/2021/02/raah-tv.jpg","http://www.raah.tv/","http://www.dailymotion.com/user/raahtv/1","1"
"310","Rajya Sabha TV","Rajya Sabha Television (RSTV) is a parliamentary TV channel fully owned and operated by the Upper House of Parliament of India i.e. Rajya Sabha. The channel provides in-depth coverage and analysis of parliamentary affairs especially the functioning of and developments related to Rajya Sabha.","https://www.youtube.com/watch?v=m7JcP4K6mUE","India","in","https://webradiodirectory.com/wp-content/uploads/2021/02/Rajya-Sabha-50x35-1.jpg","http://rstv.nic.in/","https://www.youtube.com/channel/UCISgnSNwqQ2i8lhCun3KtQg",NULL
"311","Reporter TV","Reporter TV is the first journalist driven 24×7 news channel in Malayalam. The TV channel brings the latest news updates from around the world. The Reporter Studio Complex HMT Colony (P O) is based in Kalamassery Kochi, Kerala. It also has an office in Dubai. Reporter has been on air since 11th May 2011.","https://www.youtube.com/watch?v=fylcoPrggu0","India","in","https://webradiodirectory.com/wp-content/uploads/2021/02/Reporter-TV-48x35-1.jpg","http://www.reporterlive.com/","https://www.youtube.com/channel/UCFx1nseXKTc1Culiu3neeSQ",NULL
"312","Republic Bharat","Republic Bharat is a Hindi speaking News TV channel founded by Arnab Goswami. The TV channel was launched on 6 May 2017.","https://www.youtube.com/watch?v=614UTCYPlVg","India","in","https://webradiodirectory.com/wp-content/uploads/2021/02/Republic-Bharat-48x35-1.jpg","https://bharat.republicworld.com/","https://www.youtube.com/channel/UC7wXt18f2iA3EDXeqAVuKng",NULL
"313","Rishtey","Rishtey is a free-to-air Hindi TV channel which broadcast in Mumbai through Sky and Virgin Media. The channel broadcasts re-runs of entertainment programming and various soaps.","http://www.rishteytv.com","India","in","https://webradiodirectory.com/wp-content/uploads/2021/02/rishtey-50x35-1.jpg","http://www.rishteytv.com","https://www.youtube.com/show/rishtey/videos","1"
"314","Rotana Cinema","Rotana Cinema is a free to air satellite television channel that is owned by Rotana Group network. It was launched in 2005, and broadcasts exclusively old and contemporary films in Arabic.","http://www.filmon.com/tv/channel/export?channel_id=2615&affid=223489Mv&source_type=iframe","Saudi Arabia","sa","https://webradiodirectory.com/wp-content/uploads/2021/02/rotana-cinema-60x44-1.jpg","http://www.rotana.net/",,NULL
"315","Roya TV","Roya TV is a free-subscription video on demand service owned by Watan Satellite Broadcasting which offers a rich library of television series and shows. Roya announced its vision as being an institution that is based on establishing a quality media platform with modern content that lives up to the expectations of Arab audience in the 21st century.","https://www.roya.tv/","Jordan","jo","https://webradiodirectory.com/wp-content/uploads/2021/02/royatv-50x35-1.jpg","https://www.roya.tv/",,"1"
"316","Royal News","Royal News is a 24/7 News TV channel based in Lahore, Capital of the Pakistani province of Punjab. The channel provides National and International News, Business News and sports News.","https://www.youtube.com/watch?v=Ois3qX4Z_dw","Pakistan","pk","https://webradiodirectory.com/wp-content/uploads/2021/02/Untitled18-60x44-1.jpg","http://royalnews.tv/",,NULL
"317","RT America","RT, previously known as Russia Today, is a global multilingual television news network based in Washington, D.C. RT America focuses on covering the News from an international and Russian perspective. It was founded in 2005. RT offers unique insight into many aspects of Russian history, culture and opinion. RT’s special projects are specifically tailored to bring a Russian perspective to an international audience.","https://www.rt.com/on-air/rt-america-air/embed/?source_type=iframe","Russia","ru","https://webradiodirectory.com/wp-content/uploads/2021/02/rt-60x44-1.jpg","https://www.rt.com/","https://www.youtube.com/user/RussiaToday/videos",NULL
"318","RT Arabic","RT Arabic is a global multilingual television news network based in Russia. The channel began broadcasting in 2007. The programming includes news, politics, economics, cultural, sports and tours in the press. RT Arabic is targeting on the global Arabic people. RT offers unique insight into many aspects of Russian history, culture and opinion. RT’s special projects are specifically tailored to bring a Russian perspective to an international audience.","https://arabic.rt.com/","Saudi Arabia","sa","https://webradiodirectory.com/wp-content/uploads/2021/02/RT-Arabic-60x44-1.jpg","https://arabic.rt.com/","https://www.youtube.com/user/RTarabic/videos","1"
"319","RT Documentary","RT presents a 24 hour documentary channel bringing you the best of Russia in English – RTД. We have worked for over five years making programs about the world’s largest country and taking viewers to its outermost and least known corners. Now we are ready to share them with you all in one place.","https://rtd.rt.com/on-air/embed/?source_type=iframe","Russia","ru","https://webradiodirectory.com/wp-content/uploads/2021/02/RT-Documentary-50x35-1.jpg","https://www.rt.com/shows/documentary/","https://www.youtube.com/user/RTDocumentaries/videos",NULL
"320","RT France","News TV. RT, previously known as Russia Today, is a global multilingual television news network based in Russia. RT was the first all-digital Russian TV network. RT offers unique insight into many aspects of Russian history, culture and opinion. This is the French speaking channel of RT.","https://www.youtube.com/watch?v=HAhdgPM2v3U","France","fr","https://webradiodirectory.com/wp-content/uploads/2021/02/rtfrance-50x35-1.jpg","https://francais.rt.com/","https://www.youtube.com/channel/UCqEVwTnDzlzKOGYNFemqnYA",NULL
"321","RT Movies","Part of Royal TV Private Limited, RT Movies is an Indian Hindi language movie channel. It is based out of Delhi, the capital of India and launched on July 18th, 2015. With 15 years credible history of Royal TV Private Limited in the field of media, RT Movies keeps the promise to deliver complete movie satisfaction.","http://45.77.90.56:8080/hls/mystream.m3u8","India","in","https://webradiodirectory.com/wp-content/uploads/2021/02/rtmovies-50x35-1.jpg",,,NULL
"322","RTM TV2","RTM TV2 is a television station owned and operated by the Radio Television Malaysia, a division of the Malaysian Government. It offers News, local Tamil programs, Movies and Sports.","https://rtm-player.glueapi.io/event/10148","Malaysia","my","https://webradiodirectory.com/wp-content/uploads/2021/02/RTM-TV2-50x35-1.jpg","http://tv2.rtm.gov.my/","https://www.youtube.com/channel/UCF4KdUqyxJ5Cb0NTGhZXt9g/videos","1"
"323","RTV","RTV is a satellite television channel broadcast from Bangladesh. It was launched on 26 December 2005. RTV is one stop entertainment service and provides nonstop entertainment shows from Bangladesh.","https://rtvbd.tv/","Bangladesh","bd","https://webradiodirectory.com/wp-content/uploads/2021/02/rtv-50x35-1.jpg","https://rtvbd.tv/","https://www.youtube.com/channel/UCR0hSGudjeZfnGL3uodU9Sw","1"
"324","RTV Drama","RTV Drama is part of the Syrian State Television which was founded in 1960 in Damascus. RTV Drama broadcasts Syrian soap operas.","//ok.ru/videoembed/911711870582?source_type=iframe","Syria","sy","https://webradiodirectory.com/wp-content/uploads/2021/02/rtvdrama-50x35-1.jpg","http://www.rtv.gov.sy/",,NULL
"325","RTV Nour TV","RTV Nour TV is part of the Syrian State Television which was founded in 1960 in Damascus. Nour is focused on religious programming.","//ok.ru/videoembed/911713050230?source_type=iframe","Syria","sy","https://webradiodirectory.com/wp-content/uploads/2021/02/RTV-Nour-TV-50x35-1.jpg","http://www.ortas.gov.sy/",,NULL
"326","RTV S News","RTV S News is owned and controlled by the Syrian Arab Television and Radio Broadcasting Commission (SATRBC) which connected to the Ministry of Information. It offers news and informative programs.","http://www.rtv.gov.sy/","Syria","sy","https://webradiodirectory.com/wp-content/uploads/2021/02/rtvsat-50x35-1.jpg","http://www.rtv.gov.sy/","https://www.youtube.com/user/SyriaChannels2/videos","1"
"327","Russia 24","Rissia 24 is formerly known as Vesti. The news channel which covers national and international news, is owned and operated by VGTRK, the All-Russia State Television and Radio Broadcasting Company.","http://www.vesti.ru/","Russia","ru","https://webradiodirectory.com/wp-content/uploads/2021/02/Russia-24-50x35-1.jpg","http://www.vesti.ru/",,"1"
"328","SAB TV","SAB TV is India’s only family comedy entertainment channel with a core brand promise of ‘Asli Mazaa SAB Ke Saath Aata Hai’. SAB with its impressive lineup of innovative programs and light-hearted content ranging from daily family comedy to path breaking concepts like silent comedy shows is dedicated to promoting an enjoyable “family-viewing” experience. For its differentiated programming and healthy entertainment SAB TV has also won the Brand Leadership award in Media & Entertainment space.","http://www.sabtv.com/","India","in","https://webradiodirectory.com/wp-content/uploads/2021/02/sab-tv1-44x44-1.jpg","http://www.sabtv.com/","https://www.youtube.com/user/sabtv/videos","1"
