"id","name","description","video_link","country","country_code","logo","website","channel","external"
"220","KTNV Las Vegas","KTNV-TV, channel 13, is an ABC-affiliated television station located in Las Vegas, Nevada, United States. The channel first aired in 1956. The feed features live videos from the KTNV chopper and breaking news. While not covering news the rooftopcam is activated.","http://www.ktnv.com/","United States","us","https://webradiodirectory.com/wp-content/uploads/2021/02/KTNV-50x35-1.jpg","http://www.ktnv.com/",,"1"
"221","KTUU TV","KTUU is a local NBC-affiliated television station licensed to Anchorage, Alaska. The station is owned by Gray Television. The Station is based in Anchorage.","https://www.ktuu.com/","United States","us","https://webradiodirectory.com/wp-content/uploads/2021/02/KTUU-TV-50x35-1.jpg","https://www.ktuu.com/",,"1"
"222","KTV 1","Kuwait Television is Kuwait’s official state-run television station, and part of the Kuwaiti Ministry of information. KTV1 launched in 1992. It is broadcasting Kuwaiti-produced programmes around the world.","https://www.media.gov.kw/LiveTV.aspx?PanChannel=KTV1","Kuwait","kw","https://webradiodirectory.com/wp-content/uploads/2021/02/ktv1-50x35-1.jpg","https://www.media.gov.kw/LiveTV.aspx?PanChannel=KTV1",,"1"
"223","KTV 2","Kuwait Television is Kuwait’s official state-run television station, and part of the Kuwaiti Ministry of information. The channel promotes Kuwait’s media abroad. It shows foreign viewers something of Kuwaiti culture and news, and to foster relationships between the State, the Kuwaiti public, and English speakers in Kuwait.","https://www.media.gov.kw/LiveTV.aspx?PanChannel=KTV2","Kuwait","kw","https://webradiodirectory.com/wp-content/uploads/2021/02/ktv2-50x35-1.jpg","https://www.media.gov.kw/LiveTV.aspx?PanChannel=KTV2",,"1"
"224","KTV Sport","KTV Sport and Sport Plus are Kuwaiti sports television channels run by the state-owned Kuwait Television.","https://www.media.gov.kw/LiveTV.aspx?PanChannel=KTVSports","Kuwait","kw","https://webradiodirectory.com/wp-content/uploads/2021/02/ktv-sport-50x35-1.jpg","https://www.media.gov.kw/",,"1"
"225","KVOA","KVOA (founded in 1953), is a NBC-affiliated television station serving Tucson, Arizona. KVOA streams live from 5:00am – 7:00am, 12:00pm to 12:30pm, 4:00pm to 5:00pm, 5:00pm to 5:30pm, 6:00pm to 6:30pm, and 10:00pm to 10:35pm.","https://livestream.com/KVOA/live","United States","us","https://webradiodirectory.com/wp-content/uploads/2021/02/KVOA-TUCSON-50x35-1.jpg","http://www.kvoa.com/",,NULL
"226","KXXV","KXXV (News Channel 25) is a full-power television station in Waco, Texas. It’s serving Central Texas as an ABC affiliate. Its transmitter is located near Moody, Texas. They show recorded new broadcasts.","http://www.kxxv.com/","United States","us","https://webradiodirectory.com/wp-content/uploads/2021/02/KXXV-50x35-1.jpg","http://www.kxxv.com/",,"1"
"227","Lahore News","Watch Lahore news official live streaming. Dunya Media Group has launched the “Lahore News” with precisely the same objectives as aforesaid. Lahore News believes that Lahore is the most important part of their Dunya and they plan to work towards making it truly the same for everyone.","https://www.youtube.com/watch?v=1gdGfq5RqBk","Pakistan","pk","https://webradiodirectory.com/wp-content/uploads/2021/02/lahorenews-50x35-1.jpg",,,NULL
"228","Lahore Rang","Lahore Rang covers every Color of Lahorities Life, rich Color of Lahore and Pakistan.","https://www.youtube.com/watch?v=U7zMjGfIMG8","Pakistan","pk","https://webradiodirectory.com/wp-content/uploads/2021/02/LahoreRang-50x35-1.jpg","https://lahorerang.tv/",,NULL
"229","Lakshya TV","Lakshya TV channel is one of India’s leading Gujarati spiritual television channels. Lakshya TV has been telecasting most of the major events in the spiritual world from across the India.","https://www.youtube.com/watch?v=Gg5_ahzlEyA","India","in","https://webradiodirectory.com/wp-content/uploads/2021/02/Lakshya-TV-48x35-1.jpg","http://www.lakshya.tv/",,NULL
"230","LBC Drama","LBC International or The Lebanese Broadcasting Corporation International is a privatly owned television station. LBC is base din Ghazir. The channel provides mainly Arabic TV series.","http://www.lbcgroup.tv/drama","Lebanon","lb","https://webradiodirectory.com/wp-content/uploads/2021/02/LBC-Drama-50x35-1.jpg","http://www.lbceurope.com/","http://www.youtube.com/user/lbcgroup/videos","1"
"231","LEGO City Cartoons","Watch LEGO city official live streaming. Funny animation movies for kids with full episodes cartoons and films LIVE 24/7 in English. With LEGO City Police, Fire, Arctic and many more fun episodes","http://www.lego.com","No Country","ww","https://webradiodirectory.com/wp-content/uploads/2021/02/LEGO-50x35-1.jpg","http://www.lego.com",,"1"
"232","Live Cricket","This page will help you find the official live cricket streaming link available online.","https://www.youtube.com/watch?v=CS7MgasgT5k","Pakistan","pk","https://webradiodirectory.com/wp-content/uploads/2021/02/cricket-50x35-1.jpg",,,"1"
"233","Live Cricket Commentary","Disclaimer: We have permission from Gorilla Cricket to display this audio commentary. Get live cricket scores, ball by ball audio commentary, schedules of International and Domestic cricket matches, T20 matches, IPL matches along with latest cricket news and updates.","http://tunein.com/embed/player/s225655/?source_type=iframe","No Country","ww","https://webradiodirectory.com/wp-content/uploads/2021/02/cricket-50x35-2.jpg",,,NULL
"234","Lok Sabha TV","Lok Sabha TV is a Parliament Channel. Lok Saba broadcasts live proceedings of the Lok Sabha – the House of the People of the Indian Parliament. It also broadcasts programs of general interest on issues relating to democracy, governance, social, economic and constitutional issues and citizens concerns.","http://loksabhatv.nic.in/","India","in","https://webradiodirectory.com/wp-content/uploads/2021/02/lok-sabha-57x44-1.jpg","http://loksabhatv.nic.in/",,"1"
"235","Madani TV","Madani TV is an Islamic educational TV Channel that broadcasts information on the topic or Islam. Madani Channel is a free view channel. This channel is owned by Dawat-e-Islami group. Dawat-e-Islami, a global non-political movement for the propagation of the Holy Quran and Sunnah, is serving Ummah with its Islamic centres in 195 countries of the world.","https://dstreamone.com/madnitv/urdu/player.php?source_type=iframe","Pakistan","pk","https://webradiodirectory.com/wp-content/uploads/2021/02/Untitled26-60x44-1.jpg","http://www.dawateislami.net/",,NULL
"236","Madani TV Bangla","Madani TV is an Islamic educational TV Channel that broadcasts information on the topic or Islam. Madani Channel is a free view channel. This channel is owned by Dawat-e-Islami group. Dawat-e-Islami, a global non-political movement for the propagation of the Holy Quran and Sunnah, is serving Ummah with its Islamic centres in 195 countries of the world.","https://www.youtube.com/watch?v=fxJdWuJwIAQ","Bangladesh","bd","https://webradiodirectory.com/wp-content/uploads/2021/02/almadina-60x44-1.jpg","https://www.dawateislami.net/","https://www.youtube.com/channel/UC0AMtPKwU61uDs--L04_kfQ",NULL
"237","Madina TV","Watch Madina Live TV from Al-Masjid al-Nabawi the city of the Prophet sallallahu alaihi wasallam. Almadia is free Islamic religious channel which broadcasts 24×7 transmission from Madia. Al-Madina Almonawara Medina is celebrated for containing the mosque of Muhammad sallallahu alaihi wasallam and so ranks as the second holiest city of Islam, after Mecca (Makkah). Muhammad was buried in Medina, under the Green Dome, as were the first two Rashidun (Rightly Guided Caliphs), Abu Bakr and Umar radi allahu anhum.","https://www.youtube.com/watch?v=ZB0iwIZaOiM","Saudi Arabia","sa","https://webradiodirectory.com/wp-content/uploads/2021/02/almadina-60x44-2.jpg","http://almajdtv.tv/","https://www.youtube.com/user/almajdchannels/videos",NULL
"238","Mahaa News","Mahaa News is a Live Telugu News TV channel based in Hyderabad, the Capital of the state Andhra Pradesh. International as well as regional News programs are shown.","https://www.youtube.com/watch?v=3IinZkCiyyE","India","in","https://webradiodirectory.com/wp-content/uploads/2021/02/Mahaa-News-48x35-1.jpg",,"https://www.youtube.com/channel/UCB30zQrOJNBeKerHAqvL03g",NULL
"239","Makkah","Watch Makkah live stream from Makkah almokarramah live on Makkah live. Watch Makkah Live 24/7 while listening to AlQuran AlKareem Channel Live Online streaming from Saudi Arabia.","https://www.youtube.com/watch?v=ZB0iwIZaOiM","Saudi Arabia","sa","https://webradiodirectory.com/wp-content/uploads/2021/02/MAKKAHLIVE-50x35-1.jpg","https://makkahlive.net/makkahlive.aspx",,NULL
"240","Makkah","Makkah channel live shows taraweeh prayer from Makkah/Mecca Live on Ramadan and 5 prayers everyday 24/7. Makkah or Mecca Live offers multiple webcam views located in the heart of Makkah. Makkah (the birthplace of Muhammad), is a city in the Hejaz and is the capital of Makkah Province in Saudi Arabia.","http://makkahlive.net/","United Arab Emirates","ae","https://webradiodirectory.com/wp-content/uploads/2021/02/russia1-60x44-1.jpg","http://makkahlive.net/",,"1"
"241","Manorama News","Manorama News, Kerala’s No. 1 news and infotainment channel, is a unit of MM TV Ltd., Malayala Manorama’s television venture. Manorama News was launched on August 17, 2006. The channel inherited the innate strengths of the Malayala Manorama daily newspaper and its editorial values: accuracy, credibility and fairness. It raised the bar in Malayalam television news coverage and stands for unbiased reporting, intelligent commentary and innovative programs. MM TV has offices across the country and overseas, including in major cities in Kerala, Metros and in Dubai, UAE.","https://www.youtube.com/watch?v=jjH6v95z3Nw","India","in","https://webradiodirectory.com/wp-content/uploads/2021/02/Manorama-News-50x35-1.jpg","https://www.manoramanews.com/home.html","https://www.youtube.com/channel/UCP0uG-mcMImgKnJz-VjJZmQ",NULL
"242","Marti Noticias","Radio y Television Marti is a radio and television broadcaster based in Miami, Florida. The broadcaster is financed by the United States Government (Broadcasting Board of Governors). The channel transmits anti-Castro propaganda to Cuba.","http://www.martinoticias.com/","Spain","es","https://webradiodirectory.com/wp-content/uploads/2021/02/marti-50x35-1.jpg","http://www.martinoticias.com/",,"1"
"243","Masala TV","Masala Tv is the most viewed Cooking Recipes channel among the Pakistani audiences. This is a brand of HUM Network limited, Masala Tv has the distinction of being Pakistan’s First 24/7 Food channel.","http://www.masala.tv/","Pakistan","pk","https://webradiodirectory.com/wp-content/uploads/2021/02/masala-60x44-1.jpg","http://www.masala.tv/",,"1"
"244","Mashriq TV","Al Mashriq TV is a news TV channel in Urdu language. The channel started broadcasting in 2016. Mashriq TV is one of the leading news channels of Pakistan.","https://www.youtube.com/watch?v=u5YB2Xv8f_M","Pakistan","pk","https://webradiodirectory.com/wp-content/uploads/2021/02/download-50x35-1.jpg","https://www.mashriqtv.pk/",,NULL
"245","Mathrubhumi News","Mathrubhumi News (മലയാളം: മാതൃഭൂമി ന്യൂസ്) is a 24-hour Malayalam television news channel and is one of Kerala’s most viewed TV channels. Owing to its varied presentation style and reliable content, Mathrubhumi News has become the fastest-growing news channel in Kerala. More than just a news channel, Mathrubhumi News features a host of programmes that relate to various aspects of life in Kerala.","https://www.youtube.com/watch?v=irF-4N_fHjs","India","in","https://webradiodirectory.com/wp-content/uploads/2021/02/Mathrubhumi-News-48x35-1.jpg","http://www.mathrubhumi.com/",,NULL
"246","Media One","Media One is an Indian infotainment TV channel which is owned by the Madhyamam Daily. It started broadcasting in 2011. The channel is based in Velliparamba, Kozhikode.","https://www.youtube.com/watch?v=d1iwUB9YFnA","India","in","https://webradiodirectory.com/wp-content/uploads/2021/02/media-one.jpg","http://www.mediaonetv.in/","https://www.youtube.com/channel/UC-f7r46JhYv78q5pGrO6ivA",NULL
"247","Mesa","Mesa is the community TV channel pperated by the City of Mesa, Arizona (Ch. 11). This TV channel provides city council meetings and news programs.","https://www.youtube.com/watch?v=7dMmsVp70L8","United States","us","https://webradiodirectory.com/wp-content/uploads/2021/02/Mesa-50x35-1.jpg","http://www.mesachannel11.com/",,NULL
"248","Minhaj TV","Minhaj TV broadcasts updates of Minhaj-ul-Quran International, a Pakistan-based international organization working to promote peace, tolerance, interfaith harmony and education, tackle extremism and terrorism, engage with young Muslims for religious moderation, promote women’s rights, development and empowerment, and provide social welfare and promotion of human rights.","https://www.youtube.com/watch?v=e7U0_UwtkFI","Pakistan","pk","https://webradiodirectory.com/wp-content/uploads/2021/02/minhaj-60x44-1.jpg","http://minhaj.tv/",,NULL
"249","MNN Community","MNN’s Community Channel is provided by the Manhattan’s Public Access Television (New York). Founded in 1992, Manhattan Neighborhood Network (MNN) is Manhattan’s free, public access cable network. MNN operates two media production and education facilities in Manhattan.","http://www.mnn.org/","United States","us","https://webradiodirectory.com/wp-content/uploads/2021/02/mnn-50x35-1.jpg","http://www.mnn.org/",,"1"
"250","MNN Lifestyle","MNN’s Lifestyle Channel is provided by the Manhattan’s Public Access Television (New York). Founded in 1992, Manhattan Neighborhood Network (MNN) is Manhattan’s free, public access cable network. MNN operates two media production and education facilities in Manhattan.","https://livestream.com/mnn2/events/2616018","United States","us","https://webradiodirectory.com/wp-content/uploads/2021/02/mnn-50x35-2.jpg","http://www.mnn.org/",,NULL
"251","More4","More4 is a digital television channel, owned by Channel Four Television Corporation. Lifestyle, documentaries and US drama, from brand new programmes to the best of Channel 4. This channel is for grown ups that want both mind and sense of humor stimulated. The channel was launched on 10 October 2005.","https://www.filmon.com/tv/channel/export?channel_id=97&source_type=iframe","United Kingdom","gb","https://webradiodirectory.com/wp-content/uploads/2021/02/Untitled24-60x44-1.jpg","http://www.channel4.com/programmes/catchup/m4","https://www.youtube.com/user/channel4/videos",NULL
"252","Moscow 24","Moscow 24 TV is a state owned and controlled city information TV-channel. It was founded in 1997. The channel is owned by the All-Russia State Television and Radio Company (VGTRK). The channek provides mainy News and Entertainment programming.","http://www.m24.ru/","Russia","ru","https://webradiodirectory.com/wp-content/uploads/2021/02/moscaw24-50x35-1.jpg","http://www.m24.ru/","https://www.youtube.com/infomoscow24/videos","1"
"253","Movies Channel","Watch live movies channel exclusive from the FilmOn library. Watch high quality movies live streaming.","https://www.filmon.tv/tv/channel/export?channel_id=4598&affid=223489Mv&autoPlay=1&source_type=iframe","No Country","ww","https://webradiodirectory.com/wp-content/uploads/2021/02/boldfilms-50x35-1.jpg",,,NULL
"254","MTV Lebanon","MTV was established in 1991 as a TV channel that sought to cater to the complexity and richness of its Lebanese viewers’ identity by creating a balanced mix of local, Arab, and western media content, with a special emphasis on producing local programming that is tailored to its audience and reflects their aspirations and values.","http://mtv.com.lb/Live","Lebanon","lb","https://webradiodirectory.com/wp-content/uploads/2021/02/MTV-Lebanon-50x35-1.jpg","http://www.mtv.com.lb/","https://www.youtube.com/user/mtvlebanon/videos","1"
"255","Mytv Bangladesh","Mytv is the 24 Hours television channel of Bangladesh which uses Bangli language as primary language to broadcast all it’s shows worldwide. With the commitment of excellence in innovation to uphold the Bengali culture and tradition, “Mytv” made the presents in the domain of Broadcast Media on the 15th of April, 2010 as a Satellite Television Channel.","http://mytvbd.tv/mytv-live/","Bangladesh","bd","https://webradiodirectory.com/wp-content/uploads/2021/02/Untitled221-60x44-1.jpg","http://mytvbd.tv/",,"1"
"256","NASA TV","NASA TV is the television service of the United States government agency NASA. NASA TV provides 24-hour broadcasting of live and recorded events and documentaries aimed toward the general public.","https://www.youtube.com/watch?v=nA9UZF-SZoQ","United States","us","https://webradiodirectory.com/wp-content/uploads/2021/02/nasa-50x35-1.jpg","https://www.nasa.gov/",,NULL
"257","NASA TV ISS Earth","NASA TV is the television service of the United States government agency NASA. Live video of Earth from space – as seen from the Nasa ISS live stream aboard the International Space Station.","https://www.youtube.com/watch?v=nX0sg1Gp-1w","United States","us","https://webradiodirectory.com/wp-content/uploads/2021/02/nasa-50x35-2.jpg","https://www.nasa.gov/","https://www.youtube.com/channel/UCakgsb0w7QB0VHdnCc-OVEA",NULL
"258","NBC News","NBC News is the news division of the American broadcast television network NBC. NBC was founded in 1940. Headquarter is located in New York.","https://www.youtube.com/watch?v=BUNkMxvxL2g","United States","us","https://webradiodirectory.com/wp-content/uploads/2021/02/NBC-News-50x35-1.jpg","https://www.nbcnews.com/",,NULL
"259","NBC2","NBC 2 or WBHH TV is a NBC affilitated local TV channel from Fort Myers, Florida. The channel was founded in 1968. The channel is owned by the Waterman Broadcasting Corporation.","https://www.youtube.com/watch?v=R9RpcIX-AzE","United States","us","https://webradiodirectory.com/wp-content/uploads/2021/02/nbc-48x35-1.jpg","http://www.nbc-2.com/",,NULL
"260","NDTV","NDTV or New Delhi Television Limited is a commercial Hindi TV channel that was launched in 2003. It provides both National as International News. NDTV.com broadcasts latest news, videos from India and all over the world. It was founded by Prannoy Roy, an eminent journalist and current chairman and director of NDTV Group.","https://ndtvindiaelemarchana.akamaized.net/hls/live/2003679/ndtvindia/masterp_480p@3.m3u8","India","in","https://webradiodirectory.com/wp-content/uploads/2021/02/ndtv-54x43-1.jpg","http://khabar.ndtv.com","https://www.youtube.com/user/ndtvindia/videos",NULL
"261","NDTV 24X7","NDTV 24X7 Live Streaming. NDTV is one of the leaders in the production and broadcasting of un-biased and comprehensive news and entertainment programmes in India and abroad. NDTV delivers reliable information across all platforms: TV, Internet and Mobile.","https://ndtv24x7elemarchana.akamaized.net/hls/live/2003678/ndtv24x7/masterp_480p@3.m3u8","India","in","https://webradiodirectory.com/wp-content/uploads/2021/02/ndtv247-50x35-1.jpg","https://www.ndtv.com/video/live/channel/ndtv24x7","https://www.youtube.com/channel/UCZFMm1mMw0F81Z37aaEzTUA",NULL
"262","News 18 Lokmat","Watch News 18 Lokmat live streaming. News18Lokmat is a 24-hour Marathi-language news channel based in Mumbai, Maharashtra, India. It is a joint venture between Network 18 and Lokmat Group the publisher of the newspaper Lokmat. The channel was launched as IBN Lokmat on 6 April 2008, the day of the Hindu New Year festival Gudi Padwa.","https://www.youtube.com/watch?v=C57EyN9BtVU","India","in","https://webradiodirectory.com/wp-content/uploads/2021/02/lokmat-50x35-1.jpg","https://lokmat.news18.com/live-tv/","https://www.youtube.com/channel/UCrcpw88HvKJ0skdsHniCJtQ",NULL
"263","News 24","News 24 is a 24/7 Hindi speaking News TV channel. The channel was founded in 1993. The channel covers Politics, Sports, Social News, and Entertainment. The slogan is: Think First.","https://www.youtube.com/watch?v=mjFEZjCZlfs","India","in","https://webradiodirectory.com/wp-content/uploads/2021/02/NEWS24-48x35-1.jpg","https://hindi.news24online.com/","https://www.youtube.com/channel/UCuzS3rPQAYqHcLWqOFuY0pw",NULL
"264","News 7 Tamil","News 7 Tamil is a Tamil Infotainment TV channel providing a wide array of stories ranging from domestic politics, to international affairs, human interest, business, sport, entertainment, culture, and lifestyle.","https://www.youtube.com/watch?v=_5c8Dg1S6vc","India","in","https://webradiodirectory.com/wp-content/uploads/2021/02/news-7-50x35-1.jpg","http://ns7.tv/ta","https://www.youtube.com/channel/UCGyZswzm4G-wEfRQHgMSAuw",NULL
"265","News J","News J is a 24 X 7 Tamil news broadcasting channel. The news channel is headquartered at Nungambakkam in Chennai, Tamil Nadu. It started broadcasting in 2017.","https://www.youtube.com/watch?v=YOKTpWJuMIc","India","in","https://webradiodirectory.com/wp-content/uploads/2021/02/News-J-48x35-1.jpg","https://www.newsj.tv/","https://www.youtube.com/channel/UCsfh2Zb7-m4qzT8jLhK_Fzw",NULL
"266","News Nation","News Nation is a 24-hour national Hindi news channel focusing on delivering pure news content to the Indian masses. It covers and reports news on politics, sport, defence, entertainment and international affairs. It started broadcasting news from 14 February 2013.","https://www.youtube.com/watch?v=cENxHq1pqo4","India","in","https://webradiodirectory.com/wp-content/uploads/2021/02/NEWSNATION-50x35-1.jpg","http://www.newsnation.in/","https://www.youtube.com/channel/UCsNdeLwEZf86swPD3qJJ7Dw",NULL
"267","News One","News One is Pakistan’s premier source for news updates, current affairs and infotainment. News One has a wide range of top rated TV programs, talk shows, debate shows watched by millions of Pakistani everyday. It is Urdu-language Karachi-based Pakistani news channel, launched on November 27, 2007. It is licensed by Air Waves Media (Pvt) Ltd"," https://www.mjunoon.tv/embedplayer/news-one-live.html?source_type=iframe","Pakistan","pk","https://webradiodirectory.com/wp-content/uploads/2021/02/news-one-60x36-1.jpg","http://www.newsone.tv/","https://www.youtube.com/channel/UCjHWKUbljF4hp3s5PbgK9uA/videos",NULL
"268","News X","NewsX focuses on providing viewers with the widest possible spectrum of stories, from across domestic politics, to international affairs, human interest, business, sport, entertainment, culture, and lifestyle.","https://www.youtube.com/watch?v=hrpOql5APFg","India","in","https://webradiodirectory.com/wp-content/uploads/2021/02/NewsX-50x35-1.jpg","http://www.newsx.com/","https://www.youtube.com/channel/UCytSP0M0Jdnw6qIy3Y-nTig",NULL
"269","News18 Bangla","Watch Bangla News Live on News18 Bangla, an exclusive news channel on YouTube which streams news related to West Bengal, Nation, and the World. The channel also has contemporary topic based debate and subject special series which are interesting & informative. Here you can watch Bangla news, breaking news, politics news, latest news, entertainment news, tech news, auto news, lifestyle news & more.","https://www.youtube.com/watch?v=4aZywP74vxQ","Bangladesh","bd","https://webradiodirectory.com/wp-content/uploads/2021/02/News18-Bangla-50x35-1.jpeg","https://bengali.news18.com","https://www.youtube.com/channel/UCbf0XHULBkTfv2hBjaaDw9Q/videos",NULL
"270","News18 Gujarati","ETV Gujarati is a cable and satellite television station in Ahmedabad, Gujarat, India, which provides Entertainment and Lifestyle shows. As part of the Eenadu Television Network, ETV Gujarati serves family-centered entertainment for every age group of viewers in the Guarati culture.","https://www.youtube.com/watch?v=0s_BkuwZVqk","India","in","https://webradiodirectory.com/wp-content/uploads/2021/02/News18-Gujarati-50x35-1.jpg","http://hindi.news18.com",,NULL
"271","News18 India","Watch News 18 Live Streaming. News18 India is one of the leading YouTube News channels which delivers Indian and international news live 24×7 in Hindi. A news package platform where you can find not only breaking news and news headlines but also exclusive interviews, series, mythological stories and factual stories.","https://www.youtube.com/watch?v=FORg8XkvB2E","India","in","https://webradiodirectory.com/wp-content/uploads/2021/02/news18-50x35-1.jpg","https://www.news18.com/","https://www.youtube.com/user/ibnlive/videos",NULL
"272","News18 Kannada","ETV Kannada is a cable and satellite television station in Bangalore, Karnataka, India, which provides Entertainment and Lifestyle shows. As part of the Eenadu Television Network, ETV Kannada serves family-centered entertainment for every age group of viewers in the Karnataka culture.","https://www.youtube.com/watch?v=xOhoFmuhmQ4","India","in","https://webradiodirectory.com/wp-content/uploads/2021/02/News18-Kannada-50x35-1.jpg","http://bengali.news18.com",,NULL
"273","News18 Rajasthan","Watch ETV Rajasthan live. ETV Network is a network of satellite television channels in India, news and entertainment channels. It is based in Hyderabad, India.","https://www.youtube.com/watch?v=wiCUo-jtkvU","India","in","https://webradiodirectory.com/wp-content/uploads/2021/02/News18-Rajasthan-50x35-1.jpg","http://hindi.news18.com","https://www.youtube.com/user/etvrajasthanindia/videos",NULL
"274","News18 Urdu","News18 Urdu is a cable and satellite television station from India which provides News, Entertainment and Lifestyle shows. As part of the Eenadu Television Network, News18 Urdu serves family-centered entertainment for every age group of viewers in India who speak Urdu language.","https://www.youtube.com/watch?v=dRJU8Ur7-g8","India","in","https://webradiodirectory.com/wp-content/uploads/2021/02/news-18-urdu-50x35-1.jpg","http://urdu.news18.com",,NULL
